NVME Identify Namespace 1:
nsze    : 0x6fc7d256
ncap    : 0x6fc7d256
nuse    : 0x50c2e82
nsfeat  : 0x1a
  [4:4] : 0x1	NPWG, NPWA, NPDG, NPDA, and NOWS are Supported
  [3:3] : 0x1	NGUID and EUI64 fields if non-zero, Never Reused
  [2:2] : 0	Deallocated or Unwritten Logical Block error Not Supported
  [1:1] : 0x1	Namespace uses NAWUN, NAWUPF, and NACWU
  [0:0] : 0	Thin Provisioning Not Supported

nlbaf   : 1
flbas   : 0x1
  [4:4] : 0	Metadata Transferred in Separate Contiguous Buffer
  [3:0] : 0x1	Current LBA Format Selected

mc      : 0
  [1:1] : 0	Metadata Pointer Not Supported
  [0:0] : 0	Metadata as Part of Extended Data LBA Not Supported

dpc     : 0
  [4:4] : 0	Protection Information Transferred as Last 8 Bytes of Metadata Not Supported
  [3:3] : 0	Protection Information Transferred as First 8 Bytes of Metadata Not Supported
  [2:2] : 0	Protection Information Type 3 Not Supported
  [1:1] : 0	Protection Information Type 2 Not Supported
  [0:0] : 0	Protection Information Type 1 Not Supported

dps     : 0
  [3:3] : 0	Protection Information is Transferred as Last 8 Bytes of Metadata
  [2:0] : 0	Protection Information Disabled

nmic    : 0
  [0:0] : 0	Namespace Multipath Not Capable

rescap  : 0
  [7:7] : 0	Ignore Existing Key - Used as defined in revision 1.2.1 or earlier
  [6:6] : 0	Exclusive Access - All Registrants Not Supported
  [5:5] : 0	Write Exclusive - All Registrants Not Supported
  [4:4] : 0	Exclusive Access - Registrants Only Not Supported
  [3:3] : 0	Write Exclusive - Registrants Only Not Supported
  [2:2] : 0	Exclusive Access Not Supported
  [1:1] : 0	Write Exclusive Not Supported
  [0:0] : 0	Persist Through Power Loss Not Supported

fpi     : 0x80
  [7:7] : 0x1	Format Progress Indicator Supported
  [6:0] : 0	Format Progress Indicator (Remaining 0%)

dlfeat  : 9
  [4:4] : 0	Guard Field of Deallocated Logical Blocks is set to 0xFFFF
  [3:3] : 0x1	Deallocate Bit in the Write Zeroes Command is Supported
  [2:0] : 0x1	Bytes Read From a Deallocated Logical Block and its Metadata are 0x00

nawun   : 127
nawupf  : 0
nacwu   : 0
nabsn   : 127
nabo    : 0
nabspf  : 0
noiob   : 0
nvmcap  : 7681501126656
npwg    : 31
npwa    : 0
npdg    : 31
npda    : 0
nows    : 31
mssrl   : 0
mcl     : 0
msrc    : 0
anagrpid: 0
nsattr	: 0
nvmsetid: 0
endgid  : 0
nguid   : <redacted>
eui64   : 0000000000000000
LBA Format  0 : Metadata Size: 0   bytes - Data Size: 512 bytes - Relative Performance: 0 Best 
LBA Format  1 : Metadata Size: 0   bytes - Data Size: 4096 bytes - Relative Performance: 0 Best (in use)
